{
  "activated_at": "2026-08-18T21:32:00Z",
  "activation_status": "activated",
  "authority_ceiling": "research_custody_only",
  "budget": {
    "evidence_objects": 24,
    "tool_calls": 200,
    "wall_clock_minutes": 120
  },
  "cutoff_at": "2026-08-18T21:27:16Z",
  "effective_capabilities": {
    "network": "denied",
    "repository_read": [
      "authority",
      "docs",
      "preflight/keenan-allen-ind-signing-v0",
      "runs/keenan-allen-ind-signing-v0",
      "schemas",
      "src"
    ],
    "repository_write": [
      "runs/keenan-allen-ind-signing-v0/attempts",
      "runs/keenan-allen-ind-signing-v0/run-events.jsonl"
    ],
    "tools": [
      "file-read",
      "file-write-run-scope"
    ]
  },
  "idempotency_key": "keenan-allen-ind-signing:v1:keenan-allen-ind-signing-v0",
  "inputs_ref": {
    "digest": "sha256:8dc64b58d70632269456be4a5ccb2b9508d6860b54bc658e57d3081a1a371ce7",
    "digest_mode": "tiber-canonical-json-v1",
    "path": "runs/keenan-allen-ind-signing-v0/inputs.json"
  },
  "job_ref": {
    "digest": "sha256:076648700709e2bd50d00a15c758d08d2d5c43a892d657724bbc46145c707d42",
    "digest_mode": "tiber-raw-sha256-v1",
    "job_id": "keenan-allen-ind-signing",
    "job_version": "v1",
    "path": "preflight/keenan-allen-ind-signing-v0/candidate/job.yaml"
  },
  "ops_decision_ref": {
    "approved_at": "2026-08-18T21:29:00Z",
    "approved_by": "Joseph (@Prometheus-Frameworks)",
    "decision_ref": "Prometheus-Frameworks/TIBER-Research#13 operator direction, 2026-08-18 (in-session); verbatim direction retained at preflight/keenan-allen-ind-signing-v0/authority/operator-direction-2026-08-18.json",
    "digest": "sha256:a82f7f15d2f48e464590e17e976ed0f2da50690cf4bb0998b59a73749e050e1e",
    "digest_mode": "tiber-canonical-json-v1",
    "path": "authority/keenan-allen-ind-signing-v0-activation.json"
  },
  "permitted_branch": "claude/tiber-research-issue-13-audit-hjva4p",
  "permitted_path": "runs/keenan-allen-ind-signing-v0/attempts",
  "run_id": "keenan-allen-ind-signing-v0",
  "schema_version": "research-activation/v0",
  "synthetic_fixture": false
}
