{
  "activated_at": "2026-08-14T12:39:09Z",
  "activation_status": "activated",
  "authority_ceiling": "research_custody_only",
  "budget": {
    "evidence_objects": 40,
    "tool_calls": 400,
    "wall_clock_minutes": 240
  },
  "cutoff_at": "2026-08-13T14:13:09Z",
  "effective_capabilities": {
    "network": "denied",
    "repository_read": [
      "authority",
      "docs",
      "preflight/tunsil-absence-shock-v0",
      "runs/tunsil-absence-shock-v0",
      "schemas",
      "src"
    ],
    "repository_write": [
      "runs/tunsil-absence-shock-v0/attempts",
      "runs/tunsil-absence-shock-v0/run-events.jsonl"
    ],
    "tools": [
      "file-read",
      "file-write-run-scope"
    ]
  },
  "idempotency_key": "tunsil-absence-shock:v1:tunsil-absence-shock-v0",
  "inputs_ref": {
    "digest": "sha256:e1582d95a1bdb18ed610d205d1826102cef13f19015036487d1a5f041a9de6de",
    "digest_mode": "tiber-canonical-json-v1",
    "path": "runs/tunsil-absence-shock-v0/inputs.json"
  },
  "job_ref": {
    "digest": "sha256:c09eb383e7225cf9474f455337252143ee2acececad63ce130736cd4bb1c67ae",
    "digest_mode": "tiber-raw-sha256-v1",
    "job_id": "tunsil-absence-shock",
    "job_version": "v1",
    "path": "preflight/tunsil-absence-shock-v0/candidate/job.yaml"
  },
  "ops_decision_ref": {
    "approved_at": "2026-08-13T22:15:22Z",
    "approved_by": "Joseph (@Prometheus-Frameworks)",
    "decision_ref": "https://github.com/Prometheus-Frameworks/TIBER-Research/issues/3#issuecomment-5287019126",
    "digest": "sha256:0f6cf7b3d86fb095130dd331169475ed830156b2378bd82a98d7c4cd7a33dfd7",
    "digest_mode": "tiber-canonical-json-v1",
    "path": "authority/tunsil-absence-shock-v0-activation.json"
  },
  "permitted_branch": "claude/tunsil-pilot-preflight",
  "permitted_path": "runs/tunsil-absence-shock-v0/attempts",
  "run_id": "tunsil-absence-shock-v0",
  "schema_version": "research-activation/v0",
  "synthetic_fixture": false
}
